{
  "schema_version": 1,
  "catalog_id": "business-workbench-v1",
  "curated_at": "2026-10-05",
  "freshness_days": 30,
  "sources": [
    {
      "source_id": "WB-S00",
      "url": "https://muzone.co.kr/",
      "observed_at": "2026-10-05",
      "access_status": "HTTP_200_PUBLIC_CONTENT",
      "evidence_quality": "PUBLIC_VENDOR_CLAIM",
      "response_sha256": "9a3dc1bdc04d33adf8ae4573a2aa291bb62d0c03822e56fdb5581fc02b8304f5",
      "excerpt": "뮤존 노래방 방음부스 일반형 4,630,000원 / 5,730,000원; 고급형 5,480,000원 / 6,750,000원; 뮤존플러스 업소용 8,030,000원 / 9,280,000원; K-존 방음부스 개인 사무실 가정용 2,650,000원 / 3,081,400원. 낮은 노출가격을 호가로 기록. 비교가격·옵션·VAT·설치 범위는 별도 확인.",
      "capture_method": "HTTPS GET; bounded response; manually reviewed visible text, not an executed quote or service test",
      "repository_reference": "research/workbench-source-excerpts/WB-S00.json"
    },
    {
      "source_id": "WB-S01",
      "url": "https://www.selpic.kr/kiosks",
      "observed_at": "2026-10-05",
      "access_status": "HTTP_200_PUBLIC_CONTENT",
      "evidence_quality": "PUBLIC_VENDOR_CLAIM",
      "response_sha256": "17048bfdbc446c29a430cf112b765ce7bd8bfe71c3d5942c70d9ea42139ad9e0",
      "excerpt": "모델별 제원 · 가격; 가격은 VAT 포함. SM05 베이직 견적 문의; SM05 듀얼 7,700,000원; SM06 스테이션 5,500,000원; SM08 프리미엄 9,900,000원; SM09/데스크 견적 문의. 규격 W×H×D: 54×120×35cm, 54×120×35cm, 36×64×64cm, 56.5×179×69.9cm, 58×167×69.7cm. SM08 A4 지원. 전원 220V · UTP/WiFi. 설치·배송 견적 문의. 구매·렌탈·무료 설치 상담.",
      "capture_method": "HTTPS GET; bounded response; manually reviewed visible text, not an executed quote or service test",
      "repository_reference": "research/workbench-source-excerpts/WB-S01.json"
    },
    {
      "source_id": "WB-S02",
      "url": "https://selpic.kr/service",
      "observed_at": "2026-10-05",
      "access_status": "HTTP_200_PUBLIC_CONTENT",
      "evidence_quality": "PUBLIC_VENDOR_CLAIM",
      "response_sha256": "bdb8edcb681d7e667368f47422f31ecc524281bd1b79dd22fd98ebff9f31d346",
      "excerpt": "4×6 사진 1,000원~. 사진 출력의 시작 소매가; 문서·증명 촬영 요금 아님.",
      "capture_method": "HTTPS GET; bounded response; manually reviewed visible text, not an executed quote or service test",
      "repository_reference": "research/workbench-source-excerpts/WB-S02.json"
    },
    {
      "source_id": "WB-S03",
      "url": "https://selpic.kr/events",
      "observed_at": "2026-10-05",
      "access_status": "HTTP_200_PUBLIC_CONTENT",
      "evidence_quality": "PUBLIC_VENDOR_CLAIM",
      "response_sha256": "644f137b290884f5da7151e2be6b60f110abbeddd6bc6ba9edde09326756ade1",
      "excerpt": "1일 30만원~ · 키오스크 1대 기준. 맞춤 프레임 제작부터 설치·철수, 원격 모니터링. 파트너 순가격과 정확한 범위 미확인.",
      "capture_method": "HTTPS GET; bounded response; manually reviewed visible text, not an executed quote or service test",
      "repository_reference": "research/workbench-source-excerpts/WB-S03.json"
    },
    {
      "source_id": "WB-S04",
      "url": "https://chiki.ai/product",
      "observed_at": "2026-10-05",
      "access_status": "HTTP_200_PUBLIC_CONTENT",
      "evidence_quality": "PUBLIC_VENDOR_CLAIM",
      "response_sha256": "8810c9ae013584e7ae072eb28cdd9b79a23f9302a9edb2f561139b1b78885e9c",
      "excerpt": "부가세 별도. 운송·설치비 별도 견적. 컴팩트 600만원부터 H1500 W450 D580mm; 오리지널 700만원부터 H2000 W800 D550mm; 시그니처 900만원부터 H2000 W1400 D800mm. 기기·소프트웨어 라이선스 포함. 소프트웨어 운영비·추가 커스텀 비용 별도.",
      "capture_method": "HTTPS GET; bounded response; manually reviewed visible text, not an executed quote or service test",
      "repository_reference": "research/workbench-source-excerpts/WB-S04.json"
    },
    {
      "source_id": "WB-S05",
      "url": "https://chiki.ai/rental/ai-photo-booth",
      "observed_at": "2026-10-05",
      "access_status": "HTTP_200_PUBLIC_CONTENT",
      "evidence_quality": "PUBLIC_VENDOR_CLAIM",
      "response_sha256": "cba46bfc3a582663fa988da9841f16335dc3a2a34afdd7195e26f13200bbb4cc",
      "excerpt": "1일 100만원 · 서울·대구·부산 기준 · 부가세 별도. 운송·설치·철거; 용지 무제한; 브랜드 맞춤 화면·프레임; AI 서버·원격 지원 포함. 외 지역 운송비 추가. 일정 1일 연장 35만원; 최초 1일 가격과 구별.",
      "capture_method": "HTTPS GET; bounded response; manually reviewed visible text, not an executed quote or service test",
      "repository_reference": "research/workbench-source-excerpts/WB-S05.json"
    },
    {
      "source_id": "WB-S06",
      "url": "https://radicalstorage.com/ko_kr/luggage-storage/seoul",
      "observed_at": "2026-10-05",
      "access_status": "HTTP_200_PUBLIC_CONTENT",
      "evidence_quality": "PUBLIC_VENDOR_CLAIM",
      "response_sha256": "05f826c278979c15426694f380f4fc19d6c084d98359377ad3e170152c74942f",
      "excerpt": "서울 짐 보관소 ₩5100부터 | 70개 지점. 제휴 호텔·상점; 짐 1개/일 ₩5,100. 호스트 순수취액·플랫폼 수수료·실제 볼륨 미확인.",
      "capture_method": "HTTPS GET; bounded response; manually reviewed visible text, not an executed quote or service test",
      "repository_reference": "research/workbench-source-excerpts/WB-S06.json"
    },
    {
      "source_id": "WB-S07",
      "url": "https://www.shinsunginc.kr/m/product.html?branduid=11274896&xcode=005&mcode=001&type=X",
      "observed_at": "2026-10-05",
      "access_status": "HTTP_200_PUBLIC_CONTENT",
      "evidence_quality": "PUBLIC_VENDOR_CLAIM",
      "response_sha256": "53c67f5158f8363e242fde9602276cb2b2a29beec6e5cdf3264c5dcab1aba79f",
      "excerpt": "오픈형 냉장자판기 쇼케이스 무인판매기 - 5단 (중고); 3,800,000원 / 2,500,000원. 배송비 (무료) 표시. 재고·실거래·VAT·설치·AS·재판매 회수 미확인.",
      "capture_method": "HTTPS GET; bounded response; manually reviewed visible text, not an executed quote or service test",
      "repository_reference": "research/workbench-source-excerpts/WB-S07.json"
    },
    {
      "source_id": "WB-S08",
      "url": "https://www.data.go.kr/data/15012005/openapi.do",
      "observed_at": "2026-10-05",
      "access_status": "HTTP_200_PUBLIC_CONTENT",
      "evidence_quality": "OFFICIAL_API_DOCUMENTATION",
      "response_sha256": "42241be0f10d8d483a23386b4146494e2b4751052622bbb743cc1141077a6303",
      "excerpt": "소상공인시장진흥공단_상가(상권)정보_API. REST, JSON+XML, 전국, 반경조회/영역별조회. 제공항목 상가업소번호·상호명·주소·상권업종명·표준산업분류명·경도·위도. 비용 무료, 업데이트 주기 실시간 표기. 수정일 2026-08-14. 활용신청 및 서비스키 필요. 분류의 점포 존재는 세부 서비스 일치·가동 확인 아님.",
      "capture_method": "HTTPS GET; bounded response; manually reviewed visible text, not an executed quote or service test",
      "repository_reference": "research/workbench-source-excerpts/WB-S08.json"
    },
    {
      "source_id": "WB-S09",
      "url": "https://www.shinsunginc.kr/m/product_list.html?xcode=005&type=X",
      "observed_at": "2026-10-05",
      "access_status": "HTTP_200_PUBLIC_CONTENT",
      "evidence_quality": "PUBLIC_VENDOR_CLAIM",
      "response_sha256": "f5292da23105204b511d01b5800c1fcc6f2a563f4d8b303486c97004c8ee8014",
      "excerpt": "슬림형 음료 자판기 (냉장, 카드단말기 장착, 캔/패트 판매가능) - 전국내륙 6,600,000원. 메일빈 M500 무인카페 커피머신-렌탈(48개월) 701,712원; 월 여부/보증금/포함 범위 확인 필요. M500 2026 신제품 26,400,000원. 카페퍼플먼트 X500 FULL SET 19,250,000원. 캡슐 커피 머신과 장난감 가챠를 구별.",
      "capture_method": "HTTPS GET; bounded response; manually reviewed visible text, not an executed quote or service test",
      "repository_reference": "research/workbench-source-excerpts/WB-S09.json"
    },
    {
      "source_id": "WB-LOCKER",
      "url": "https://korean.visitseoul.net/attractions/Luggage-Lounge-Anguk-Locker/KOPy2nopb",
      "observed_at": "2026-10-03",
      "access_status": "INHERITED_NOT_CURRENTLY_VERIFIED",
      "attempted_at": "2026-10-05",
      "evidence_quality": "INHERITED_REPOSITORY_C2",
      "response_sha256": null,
      "excerpt": "국내 무인 짐보관·카드 키오스크·사이즈별 락커 배포",
      "repository_reference": "research/korea-feasibility-source-notes-v1.md"
    },
    {
      "source_id": "WB-PRINT",
      "url": "https://english.visitseoul.net/entertainment/printcafe/ENPz0djo8",
      "observed_at": "2026-10-03",
      "access_status": "INHERITED_NOT_CURRENTLY_VERIFIED",
      "attempted_at": "2026-10-05",
      "evidence_quality": "INHERITED_REPOSITORY_C2",
      "response_sha256": null,
      "excerpt": "서울 24시간 셀프 문서 출력/복사/팩스/스캔 배포",
      "repository_reference": "research/korea-feasibility-source-notes-v1.md"
    },
    {
      "source_id": "WB-MRO",
      "url": "https://www.serveone.co.kr/kr/purchasing-service/mro.do",
      "observed_at": "2026-10-03",
      "access_status": "INHERITED_NOT_CURRENTLY_VERIFIED",
      "attempted_at": "2026-10-05",
      "evidence_quality": "INHERITED_REPOSITORY_C2",
      "response_sha256": null,
      "excerpt": "국내 반복 MRO 통합 구매 서비스 모델",
      "repository_reference": "research/korea-feasibility-source-notes-v1.md"
    }
  ],
  "variants": [
    {
      "variant_id": "BOOTH-CALL",
      "parent_candidate_id": "OC-001",
      "label": "업무·통화 시간제 부스",
      "customer_job": "독립된 통화·업무 공간",
      "payer": "개인 이용자",
      "revenue_unit": "점유 분",
      "economic_model": "TIME",
      "equipment_service_class": "상업 통화 부스 + 결제/환기",
      "typical_host_archetype": "오피스·공유공간",
      "direct_competition_taxonomy": [
        "통화부스",
        "폰부스",
        "전화부스"
      ],
      "substitute_taxonomy": [
        "회의실",
        "공유오피스"
      ],
      "required_site_attributes": [
        "소방·환기·차음·접근성·전력"
      ],
      "capex_components": [
        "상업부스",
        "결제기",
        "환기",
        "설치"
      ],
      "opex_components": [
        "청소",
        "전력",
        "지원",
        "임대/호스트"
      ],
      "revenue_variables": [
        "price_per_minute",
        "USER_ENTERED_VOLUME_ONLY"
      ],
      "operational_constraints": [
        "잠금·환기 장애 즉시 대응 책임"
      ],
      "legal_regulatory_unknowns": [
        "건물 용도·소방·상업 사용·기기 안전"
      ],
      "source_ids": [
        "WB-S00"
      ],
      "deployment_evidence": "COMMERCIAL_SERVICE_UNPROVEN",
      "commercial_models": [
        "OWNED",
        "RENTED"
      ],
      "competition_rules": {
        "direct": [
          "통화부스",
          "폰부스",
          "전화부스"
        ],
        "substitute": [
          "회의실",
          "공유오피스"
        ]
      }
    },
    {
      "variant_id": "BOOTH-FOCUS",
      "parent_candidate_id": "OC-001",
      "label": "집중·연습 방음 공간",